Link,Question,Follows,Answers
https://answers.yahoo.com/question/index?qid=20110720191251AAwkIVs,Should I apply part-time or full-time...?,0,5
https://ca.answers.yahoo.com/question/index?qid=20090805081740AA7zgh4,Fly fishing ( how long should the leader be?)?,0,5
https://au.answers.yahoo.com/question/index?qid=20080725154514AAxo49D,What & how much food should my 9 week old Jack Russell?,0,10
https://answers.yahoo.com/question/index?qid=20080327092115AA70fLP,Should your past matter to future relationships?,0,36
https://answers.yahoo.com/question/index?qid=20091112203356AA9mnTa,Should my buttermilk be lumpy?,0,6
https://answers.yahoo.com/question/index?qid=20111011041522AAPK3DF,How should muslim men dress according to the quran and sunnah etc?,4,11
https://answers.yahoo.com/question/?qid=20100826024255AAH7Leh,Should women be allowed to go topless in public...or not?,3,26
https://au.answers.yahoo.com/question/index?qid=20080112030105AAQe5rE,How often should you give your guinea pig a bath??,4,12
https://ca.answers.yahoo.com/question/index?qid=20101007122928AARN0l6,"To increase the mechanical advantage of a lever, should you increase or decrease the length of the output arm?",0,6
https://au.answers.yahoo.com/question/index?qid=20110102204621AAPzJDj,Should engagement rings be yellow or white gold?,0,13
https://answers.yahoo.com/question/index?qid=20080520195006AAMV4dK,Should I paint the wall or the trim first?,0,10
https://nz.answers.yahoo.com/question/index?qid=20100925060433AAoLYHo,Should the method be in past tense when writing up a laboratory report?,0,2
https://answers.yahoo.com/question/index?qid=20080306005720AACcChK,"""Ah, but a man's reach should exceed his grasp"".?",3,7
https://answers.yahoo.com/question/index?qid=20110727222204AAZEFZ5,At what age should a child be responsible for cleaning their own room?,0,14
https://in.answers.yahoo.com/question/index?qid=20081205035740AAmQCb3,Should i take science or commerce????im totally confused................?,1,10
https://answers.yahoo.com/question/?qid=20060623195345AAa9NFL,What time of the day or night should I take my Norvasc tablet (5 mg) for maintainenance of blood pressure?,2,15
https://answers.yahoo.com/question/index?qid=20080307014511AAEQD7V,How long should one paragraph be?,0,13
https://answers.yahoo.com/question/index?qid=20060705110655AAQJZis,How long should I wait to start another relationship? I just broke off a 3 year relationship.?,1,12
https://ca.answers.yahoo.com/question/index?qid=20111218110124AAfbMjd,How long should you wait to do sexual things in a relationship you care about?,2,17
https://answers.yahoo.com/question/?qid=20060809115422AAdvEmO,Replacing Interior doors - What size should I order?,0,9
https://au.answers.yahoo.com/question/index?qid=20091103124502AAemiMn,Should we allow asylum seekers into Australia (without locking them up)?,0,6
https://answers.yahoo.com/question/index?qid=20090515223228AA2zgsY,Should I see a doctor if I have sunburn blisters?,0,9
https://au.answers.yahoo.com/question/index?qid=20070121195738AAdrVJ5,Which hands should you hold your knife / fork in when eating out?,1,18
https://sg.answers.yahoo.com/question/index?qid=20070716112416AAHAmgM,Should i run before or after my workout?,0,-1
https://in.answers.yahoo.com/question/index?qid=20110506103017AAbnp38,Should Uniforms Be compulsory in schools? Yes/No why ?,1,16
https://au.answers.yahoo.com/question/index?qid=20110111231351AA60LVl,Should I get McDonald's or KFC for dinner?,0,16
https://ca.answers.yahoo.com/question/index?qid=20101213170005AAbVAle,"Voting age Debate ""The voting age should stay at 18""?",0,4
https://answers.yahoo.com/question/index?qid=20070527115736AAIpgfg,At what age should kittens start eating solid food?,3,5
https://ca.answers.yahoo.com/question/index?qid=20100609023155AAGIEUx,"""Ultimately, the only power man should aspire to is that which he exercises over himself.""?",1,7
https://answers.yahoo.com/question/index?qid=20100622010730AAEQsnw,Should i learn guitar scales before learning chords?,0,15
https://answers.yahoo.com/question/?qid=20060708082643AAivzjI,How long after a spouse dies should you wait to get married again?,0,37
https://au.answers.yahoo.com/question/index?qid=20061001012913AAObbTb,How much sleep should a 13 year old get each day?,1,15
https://sg.answers.yahoo.com/question/index?qid=20100908004611AAMTOM1,Should Singapore get rid of Singlish?,0,197
https://ca.answers.yahoo.com/question/index?qid=20110927203912AAmIJuu,What should my first Tumblr post be?,0,6
https://answers.yahoo.com/question/index?qid=20120101030502AAQD2Hj,Should I have sex before marriage?,0,18
https://sg.answers.yahoo.com/question/index?qid=20120402092904AAwsjVZ,"My boyfriend had cheated on me twice, What should I do?",2,11
https://ca.answers.yahoo.com/question/index?qid=20100415001345AAkzfzH,Should i put my scotch into the fridge?,2,8
https://au.answers.yahoo.com/question/index?qid=20081223020934AAgQJoD,"Im 27 weeks pregnant, how many centimetres should my stomach be measuring?",0,6
https://au.answers.yahoo.com/question/index?qid=20100501012603AATupb7,"How far should I go with my boyfriend, I'm 14?",0,11
https://au.answers.yahoo.com/question/index?qid=20071115225433AAENhKi,Should I tell my boyfriend I kissed another guy??,1,29
https://au.answers.yahoo.com/question/index?qid=20091201180829AAPrYyL,CAR question - Should the A/C button be ON when the heater is ON?,1,13
https://answers.yahoo.com/question/index?qid=20081227191009AAblk7L,How often should i get my skates sharpened?,0,13
https://answers.yahoo.com/question/index?qid=20100802083109AAn5M2Q,How can I make my penis grow bigger. What foods should I eat?,8,-1
https://nz.answers.yahoo.com/question/index?qid=20130129144301AAVNJhr,How much water should be added to 12ml of 8% alcohol solution to reduce the concentration to 6%?,0,2
https://in.answers.yahoo.com/question/index?qid=20070112135510AAD7SB8,What should we do to free our planet from terrorism?,4373,31269
https://answers.yahoo.com/question/index?qid=20160628130237AAD7xZX,Should I do this to her necklace?? (*will give best answer* )?,0,1
https://au.answers.yahoo.com/question/index?qid=20090515095928AAFxQqm,What should your cervix feel like at 30 weeks pregnant?,0,3
https://au.answers.yahoo.com/question/index?qid=20090612140900AAyfsYi,Should i let my female siberian husky breed?,0,10
https://answers.yahoo.com/question/?qid=20081220040505AAMI4Xe,How fast should my internet connection speed be to play PS3 online?,0,-1
https://answers.yahoo.com/question/?qid=20060620125338AASrFcK,Should married men go to strip clubs?,1,36
https://ca.answers.yahoo.com/question/index?qid=20100125204806AAcWUQs,"Should ""L"" (for ""lord"") be capitalized in the following sentence?",0,3
https://answers.yahoo.com/question/index?qid=20100514112643AAGiOqi,I already bought a gift via the wedding gift registry. Should I still bring them a card at the wedding?,0,11
https://answers.yahoo.com/question/index?qid=20090111160824AAJUuro,Should I eat every 2 or 3 hours?,5,37
https://answers.yahoo.com/question/index?qid=20060716102255AAuJB1o,Why should slavery end?,0,20
https://answers.yahoo.com/question/index?qid=20061211095723AALD9LJ,Which wines should be drank cold or room temp.??,0,6
https://answers.yahoo.com/question/index?qid=20160628201502AA8RVLO,,,
https://in.answers.yahoo.com/question/index?qid=20060901045944AAhDWzg,How much water should an adult male cat (10yrs old) drink a day?,0,9
https://ca.answers.yahoo.com/question/index?qid=20120302112044AA7pAgd,How much and often should i feed my Black Moor Goldfish?,0,6
https://ca.answers.yahoo.com/question/index?qid=20070126080634AA78C87,Should cellphones be allowed in schools?,34,390
https://answers.yahoo.com/question/index?qid=20071011065723AAT69or,Rebuilt/Salvage Title.....should I buy a car with one?,1,10
https://answers.yahoo.com/question/?qid=20060627084337AAUASp9,"How much should you feed your betta fish, how many times a day?",0,14
https://sg.answers.yahoo.com/question/index?qid=20070621073125AATCgKw,How long should a proper bath be ?,0,10
https://answers.yahoo.com/question/index?qid=20160628142142AAtAcKr,"In this moment of crisis in Turkey , should turkey consider deporting it's muslim immigrants ?",0,6
https://in.answers.yahoo.com/question/index?qid=20081122052143AAnUvZH,Should celebrities keep out of politics?,1,14
https://answers.yahoo.com/question/?qid=20121213120053AApdi16,How and what age should you tell your kids about Santa?,50,739
https://answers.yahoo.com/question/?qid=20090203194046AA2WCN4,Should i delete my computer cookies?,3,21
https://answers.yahoo.com/question/index?qid=20110928163320AAFVsys,What age should you start having sex?,1,20
https://ca.answers.yahoo.com/question/index?qid=20100804170546AAtztpA,I want to join the canadian army. what should i excpect?,0,4
https://ca.answers.yahoo.com/question/index?qid=20130404120239AAgrVlC,Should I block her on Facebook during no contact rule?,0,6
https://answers.yahoo.com/question/index?qid=20081008110342AANIEz6,How much food should I feed my betta fish?,2,-1
https://sg.answers.yahoo.com/question/index?qid=20110106234108AAIoUJA,"Should I get a Tongue piercing, and why or why not?",1,7
https://ca.answers.yahoo.com/question/index?qid=20090215162328AASMMCx,What role should the government play in the economy...?,0,11
https://ca.answers.yahoo.com/question/index?qid=20130101223856AAPzFG6,My boyfriend wants to get a tattoo. I hate tattoos. What should I do?,0,10
https://ph.answers.yahoo.com/question/index?qid=20101205224835AAqcuIn,Should let my friend tattoo me?,0,20
https://au.answers.yahoo.com/question/index?qid=20101007041428AA8oKDH,My ear piercing may be infected - should I take it out or leave it in?,0,6
https://ph.answers.yahoo.com/question/index?qid=20100331045728AAiDiRU,Should I Join Facebook? Why and Why not?,0,-1
https://au.answers.yahoo.com/question/index?qid=20081113022108AAdnTfa,What should 14 year olds be allowed to do?,1,22
https://au.answers.yahoo.com/question/index?qid=20080307002639AAIYIyI,How much board should i pay to my parents?,0,11
https://au.answers.yahoo.com/question/index?qid=20120410102646AAovfsd,Should I shave My legs without asking my mom?,0,10
https://answers.yahoo.com/question/index?qid=20080213092714AAkZgYR,When should I get my 1099-Misc Form?,0,4
https://answers.yahoo.com/question/index?qid=20110825233323AAeySsQ,Should i shave my head & wear a wig while my hair grows?,1,7
https://au.answers.yahoo.com/question/index?qid=20090306014829AAoTCJa,If I get 2 puppies what sexes should I get?,0,10
https://ca.answers.yahoo.com/question/index?qid=20111220154531AABBt8O,Should I read or watch ? - Black butler?,1,7
https://au.answers.yahoo.com/question/index?qid=20100620010714AA1dp7D,"Should i cook steak on low,medium or high heat and how long?",3,17
https://ca.answers.yahoo.com/question/index?qid=20110402131756AArULpW,Should men always be in charge?,1,12
https://au.answers.yahoo.com/question/index?qid=20080728194312AAXGw1A,Should I tell my husband's mistress' husband about their affair?,2,34
https://ca.answers.yahoo.com/question/index?qid=20101016082116AAKLW5J,Reasons why we should not privatize health care in Canada.?,2,15
https://ca.answers.yahoo.com/question/index?qid=20120313022056AAx3lPy,Should men shave their pubic hair?,1,10
https://answers.yahoo.com/question/index?qid=20060711100042AAhHqPG,How often do 1 week old kittens(bottlefed) poop? Should there tummys look slightly bloated or is that bad?,0,21
https://answers.yahoo.com/question/index?qid=20100727222731AAiDgjv,Omg ! My dog's getting spayed tomorrow ! What should I expect ?,1,9
https://ca.answers.yahoo.com/question/index?qid=20100708194347AAOzoof,Should I go to the I.B. program?,0,4
https://au.answers.yahoo.com/question/index?qid=20091231225300AA8njc5,What age should you start getting into the  modeling business?,0,7
https://au.answers.yahoo.com/question/index?qid=20090423012706AAC94WS,What shade should your concealer be? should it be lighter or darker than the foundation?,0,9
https://answers.yahoo.com/question/index?qid=20120328210642AAPxnnl,Should the United States have gone into war with vietnam?,1,8
https://au.answers.yahoo.com/question/index?qid=20100611164709AAhLbEI,Should pregnant women buy baby formula before child is born?,0,10
https://ca.answers.yahoo.com/question/index?qid=20120421214156AAGI8aT,When i shower/sleep should i take my gauges/plugs/tunnels/tapers out?,0,6
https://au.answers.yahoo.com/question/index?qid=20091115015402AAH1vN2,How much water should drip out of pressure relief valve on hot water tank?,0,5
https://au.answers.yahoo.com/question/index?qid=20101130140544AA3B76E,Should the reservoir tank always be full of coolant?,1,6
https://ca.answers.yahoo.com/question/index?qid=20121227180822AAgvQKJ,How often should a mini split heat pump go into defrost mode?,0,3
https://au.answers.yahoo.com/question/index?qid=20110515171448AA7lHRX,Should I get another dog to keep my cocker spaniel company?,0,8
https://answers.yahoo.com/question/index?qid=20120501104605AAaRPZX,How thick should grout be for ceramic tile?,0,6
https://answers.yahoo.com/question/index?qid=20081220194120AAeL2yc,Should you tip at buffet restaurants?,0,18
https://ca.answers.yahoo.com/question/index?qid=20110510133900AAnDYbY,Do you think people with autism/AS should not have children?,3,12
https://answers.yahoo.com/question/index?qid=20060709211211AAOdV7j,When should a waiter remove a plate?,0,16
https://ca.answers.yahoo.com/question/index?qid=20130202130342AAWk7oo,"How much should a 13 year old girl weigh, and height of 5'0?",0,4
https://au.answers.yahoo.com/question/index?qid=20101104152249AAcngIL,How long should you leave a taper in before switching it to a plug?,0,2
https://au.answers.yahoo.com/question/index?qid=20080108072717AA6HoQi,How long before a puppy's bed time should we take away his food and water?,2,13
https://malaysia.answers.yahoo.com/question/index?qid=20071102175328AAnw0tw,How long should I wait after workout to eat something?,0,3
https://sg.answers.yahoo.com/question/index?qid=20110903080415AAjXcjY,How long should a German shepherd puppy be walked?,0,4
https://answers.yahoo.com/question/index?qid=20060623130938AAdUpDh,Should i wear underwear under my swim trunks?,0,23
https://sg.answers.yahoo.com/question/index?qid=20090210201218AAg8uKE,Should I text him or just forget about him?,0,38
https://au.answers.yahoo.com/question/index?qid=20091105033402AA91Cef,Should i trust the mirror or the camera?,2,10
https://answers.yahoo.com/question/index?qid=20120123202226AAE1Wgm,Should I really shave/wax my pubic hair?,1,17
https://au.answers.yahoo.com/question/index?qid=20120723020608AA0n9Ga,How far should 15 year olds go sexually?,0,9
https://answers.yahoo.com/question/index?qid=20111222115122AAzY4xq,How often should you check your motor oil in a car?,1,11
https://answers.yahoo.com/question/index?qid=20121224150323AAsYS1D,Should I spend Christmas with my family or my girlfriend's family?,1,11
https://answers.yahoo.com/question/index?qid=20111202143752AA2gLuI,Do you think alimony should be abolished?,0,23
https://ca.answers.yahoo.com/question/index?qid=20120411161415AAoWpic,"Why should Canada provide refugee status to all who request it, and why?",0,3
https://ph.answers.yahoo.com/question/index?qid=20130214191534AA1IsFq,How long should i wait to drive after drinking 40% alcohol ( a pint)?,0,7
https://answers.yahoo.com/question/index?qid=20110913165830AA00L5t,How should a belly piercing look after a month?,0,2
https://sg.answers.yahoo.com/question/index?qid=20091207171915AAmUtZ2,How long do you feel a relationship should last before marriage?,0,7
https://answers.yahoo.com/question/index?qid=20100505122146AACNbGm,Which one should i join? National Guard or Army Reserves?,0,8
https://ca.answers.yahoo.com/question/index?qid=20100914132937AAzCxBR,Why should you use a blue flame instead of a yellow flame?,0,2
https://au.answers.yahoo.com/question/index?qid=20070121195738AAdrVJ5,Which hands should you hold your knife / fork in when eating out?,1,18
https://answers.yahoo.com/question/index?qid=20090404160158AAVRQnV,How long should I wait before I stretch my ear a bigger size?,0,10
https://ca.answers.yahoo.com/question/index?qid=20100708194347AAOzoof,Should I go to the I.B. program?,0,4
https://au.answers.yahoo.com/question/index?qid=20110823200835AAM75ws,Should I desex my male german shepherd puppy?,1,7
https://answers.yahoo.com/question/index?qid=20120123202226AAE1Wgm,Should I really shave/wax my pubic hair?,1,17
https://answers.yahoo.com/question/index?qid=20111011041522AAPK3DF,How should muslim men dress according to the quran and sunnah etc?,4,11
https://answers.yahoo.com/question/index?qid=20100902200536AAvULWg,How far down should the foreskin go?,1,13
https://sg.answers.yahoo.com/question/index?qid=20111108234639AAJKgte,How big of mice should i feed my ball python?,0,6
https://in.answers.yahoo.com/question/index?qid=20081205035740AAmQCb3,Should i take science or commerce????im totally confused................?,1,10
https://in.answers.yahoo.com/question/index?qid=20081221084736AAsGFi4,Should india wage a war against pakistan?,1,30
https://ph.answers.yahoo.com/question/index?qid=20100309004119AAJPbdn,Why should banned china products?,0,9
https://answers.yahoo.com/question/index?qid=20120501104605AAaRPZX,How thick should grout be for ceramic tile?,0,6
https://answers.yahoo.com/question/?qid=20061113084201AAFHsMa,Should you refrigerate an opened bottle of red wine?,2,6
https://au.answers.yahoo.com/question/index?qid=20100709223736AAD1xNm,Should I wash my makeup brushes before using them?,1,9
https://ca.answers.yahoo.com/question/index?qid=20130101223856AAPzFG6,My boyfriend wants to get a tattoo. I hate tattoos. What should I do?,0,10
https://answers.yahoo.com/question/index?qid=20100622010730AAEQsnw,Should i learn guitar scales before learning chords?,0,15
https://answers.yahoo.com/question/index?qid=20120101030502AAQD2Hj,Should I have sex before marriage?,0,18
https://answers.yahoo.com/question/index?qid=20080327092115AA70fLP,Should your past matter to future relationships?,0,36
https://answers.yahoo.com/question/index?qid=20111127221219AAuGmGk,How long should you stay awake after a concussion?,0,1
https://answers.yahoo.com/question/index?qid=20080520072503AAVNVsr,Chicago Midway aiport fliers..how early should we arrive?,0,5
https://answers.yahoo.com/question/index?qid=20160628141952AAviI4n,,,
https://uk.answers.yahoo.com/question/index?qid=20160601101718AA2N7TG,Bossy friend has dumped me - should I be pleased?,1,19
https://answers.yahoo.com/question/index?qid=20160628215223AAzqjqe,What should you do when faced with writer's block?,0,2
https://answers.yahoo.com/question/index?qid=20160628161512AANdqvZ,Should self help guru Tony Robbins be charged for burning 30 people for walking on hot coals?,0,7
https://answers.yahoo.com/question/index?qid=20160628205259AAcPzBa,Should I put excess payment towards a higher loan balance with lower interest rate or lower loan balance with higher interest rate?,0,1
https://answers.yahoo.com/question/index?qid=20160628133359AAuLs0h,How much should i charge for this cake?,0,5
https://answers.yahoo.com/question/index?qid=20160628132128AAUyJm7,Could I become a kpop idol? For what companies should I audition for?,0,1
https://answers.yahoo.com/question/index?qid=20160628225650AALwl8W,"We don't need tighter borders, if anything, we should be loosening the borders up?",0,5
https://answers.yahoo.com/question/index?qid=20160628215330AAs25yA,WHO SHOULD I BELIEVE IN THIS SITUATION!?,0,-1
https://answers.yahoo.com/question/index?qid=20160628175438AA4Cl2E,"Should we just send some hardcore death squads into the ISIS strongholds of Mosul and Raqqa, and kill everything that moves there?",0,7
https://au.answers.yahoo.com/question/index?qid=20130728040300AA2zLwJ,How many hours should i spend on electronics?,0,2
https://au.answers.yahoo.com/question/index?qid=20160601203021AACoZ1a,"I'm hungry, what should I eat?",0,10
https://ph.answers.yahoo.com/question/index?qid=20160520082140AANfkoT,What camera I should buy?,0,14
https://ca.answers.yahoo.com/question/index?qid=20131123062715AAc9TcL,Should I unplug ps4 when I turn it off?,0,5
https://answers.yahoo.com/question/index?qid=20080208090729AAd3NVt,"Do you use ""it should also has"" or ""it should also have"" in sentence?",0,7
https://ca.answers.yahoo.com/question/index?qid=20160616121017AAve0sn,Should i commit sudoku?,0,3
https://au.answers.yahoo.com/question/index?qid=20160523052747AAOlr5D,Should I try a cigarette?,0,8
https://ca.answers.yahoo.com/question/index?qid=20160522042325AAiWZfC,"I was up all night, what time should I go to bed and what time should I wake up?",0,1
https://answers.yahoo.com/question/index?qid=20130715141157AALImfq,How often should restaurants clean bathrooms?,0,5
https://ph.answers.yahoo.com/question/index?qid=20160601090705AA3wX7C,Should I shave my legs?,2,24
https://ca.answers.yahoo.com/question/index?qid=20160615212044AAmRWX8,Should I take grade 11 chemistry?,0,1
https://au.answers.yahoo.com/question/index?qid=20160517201014AArmKPO,Should Donald Trump or Hillary Clinton be the next American president?,0,9
https://ca.answers.yahoo.com/question/index?qid=20130729105507AAso6Gq,Should I always pay for my girlfriend?,0,6
https://ca.answers.yahoo.com/question/index?qid=20160529114149AAQgr8O,What dog should i get?,0,7
https://ca.answers.yahoo.com/question/index?qid=20160523181029AAka8KH,Do you think Mo Williams should get more minutes over Matthew Dellavedova?,0,2
https://ca.answers.yahoo.com/question/index?qid=20160504174015AAjHZvd,What should I do?,0,7
https://ca.answers.yahoo.com/question/index?qid=20090820142426AATvSpW,Should you be able to see the tampon ?,0,11
https://ca.answers.yahoo.com/question/index?qid=20160418214600AAIDdac,,,
https://ca.answers.yahoo.com/question/index?qid=20160615120032AA46t9n,My stool is very dark (almost black) in color. When should I see a doctor?,0,4
https://ca.answers.yahoo.com/question/index?qid=20160612115913AABU6R8,Should I take a year off school and learn to develop mobile apps?,0,6
https://ca.answers.yahoo.com/question/index?qid=20130628140801AA2c0Ss,Who should have more authority in the economic affairs of a nation?,0,-1
https://answers.yahoo.com/question/index?qid=20130625223919AAd0HC2,Should I get the Xbox One or PS4?,2,10
https://ca.answers.yahoo.com/question/index?qid=20160602122124AAUc4eM,"Should a Female, Age 25, see a gynecologist even though she is still a virgin?",0,12
https://ca.answers.yahoo.com/question/index?qid=20160613135358AAJdc4N,Ramadan: Why should more than 1.6 billion peace loving Muslims have to apologize for something that they didn't do or were not part of?,1,17
https://au.answers.yahoo.com/question/index?qid=20130701061933AAecPf1,What order should my boot priorities be in BIOS?,0,2
https://ca.answers.yahoo.com/question/index?qid=20110227181742AAGjjNS,Should I get an Alaskan Husky or Malamute?,1,22
https://answers.yahoo.com/question/?qid=1006031504023,How high should a dart board be hung - and how far away does the player stand?,0,7
https://ca.answers.yahoo.com/question/index?qid=20160505072019AApcXI7,"Help with homework! With 10percent deflation, after one year you should be able to sell the building for...? and more?",0,1
https://ca.answers.yahoo.com/question/index?qid=20130606141545AAej88J,Should I learn to play the ukulele before I learn the guitar? (+ more questions)?,0,7
https://au.answers.yahoo.com/question/index?qid=20130621055253AAdBp8G,Should I upgrade from my Nikon D3100?,0,11
https://in.answers.yahoo.com/question/index?qid=20130620022913AAmMiBs,One should be satisfied with what they have or they should always want and strive for something more?,1,8
https://ca.answers.yahoo.com/question/index?qid=20071122160049AA3PASd,Science lab report- what should the analysis section include?,0,5
https://au.answers.yahoo.com/question/index?qid=20130713234037AAItZch,"Nearsighted glasses, Should I wear them all the time?",0,12
https://au.answers.yahoo.com/question/index?qid=20130122142129AAyIJx5,Should the date of Australia Day be changed from 26 January to be more inclusive?,7,25
https://ca.answers.yahoo.com/question/index?qid=20160606023502AAQHl8J,"When (if) Trump becomes Pres., should my country change its name to Trump America?",0,3
https://au.answers.yahoo.com/question/index?qid=20160511235850AAMwwQc,Should i wear my curly hair to school?,0,8
https://ca.answers.yahoo.com/question/index?qid=20160523061639AATRc0n,Why would this girl act like that ? How should I react ?,0,1
https://answers.yahoo.com/question/index?qid=20111009094242AAuOYIA,Why should Quebec stay with Canada?,0,7
https://ca.answers.yahoo.com/question/index?qid=20160521172135AAp9KTu,,,
https://ca.answers.yahoo.com/question/index?qid=20160612172507AArAdBw,"'i dropped a paint brush down my cold air duct return, should i be concerned?'?",0,2
https://ca.answers.yahoo.com/question/index?qid=20130513134359AA5S0eu,How deep should my arrow quiver be?,0,5
https://answers.yahoo.com/question/index?qid=20130513131658AAKhnfS,Should I kill paarthurnax in Skyrim?,0,7
https://au.answers.yahoo.com/question/index?qid=20110829193213AAD0Nf6,What age horse should I buy?,0,11
https://ca.answers.yahoo.com/question/index?qid=20160611132817AAzsTQ3,,,
https://ca.answers.yahoo.com/question/index?qid=20160605234846AAAPsdj,"Do you believe someone who is in so much mental agony, should have the right to die?",0,3
https://ca.answers.yahoo.com/question/index?qid=20160525085451AAjikmT,As a Conservative should I vote for Hillary Clinton or Bernie Sanders?,0,19
https://ca.answers.yahoo.com/question/index?qid=20160416115349AArgp0d,"Should all american women be sterilized, and so-called 'men' have their tubes tied, in order to prevent any further american births?",0,13
https://ca.answers.yahoo.com/question/index?qid=20130309144752AAHdSaF,Calculate the volume of NaOH that should neutralize the KHP sample.?,0,1
